{
  "id": "google-ai-studio",
  "name": "Google AI Studio",
  "category": "api-provider",
  "url": "https://aistudio.google.com",
  "lastVerified": "2026-09-19",
  "tiers": [
    {
      "name": "Free",
      "monthlyPrice": 0,
      "limits": {
        "RPM": "15 requests/min",
        "TPM": "1,000,000 tokens/min",
        "RPD": "1,500 requests/day"
      },
      "models": [
        "Gemini 3.8 Flash",
        "Gemini 3.1 Pro"
      ],
      "estimatedTokenBudget": {
        "description": "1,500 requests/day (~15M tokens/mo)",
        "estimatedMillionTokens": 15,
        "assumptions": "1,500 requests/day on free rate limits",
        "estimateMeta": {
          "sourceUrl": "https://aistudio.google.com",
          "sourceType": "research",
          "confidence": "low",
          "verifiedAt": "2026-09-19"
        }
      },
      "notes": "Free tier with generous TPM limits"
    },
    {
      "name": "Tier1",
      "monthlyPrice": null,
      "limits": {
        "spendCap": "$250/mo spend limit",
        "RPM": "1,000 requests/min",
        "TPM": "4,000,000 tokens/min"
      },
      "models": [
        "Gemini 3.8 Flash",
        "Gemini 3.1 Pro"
      ],
      "estimatedTokenBudget": {
        "description": "PAYG up to $250/mo spend cap (~67M conservative / ~130M cached-agent tokens @ $100)",
        "estimatedMillionTokens": 67,
        "midpointEstimate": 100,
        "optimisticEstimate": 130,
        "assumptions": "Official Gemini 3.8 Flash pricing $0.75/M in, $3.75/M out ($0.75 promotional through 2026-12-31): $100 buys ~67M on a 3:1 list blend and ~130M on the standard 75%-cached agent request; 100M midpoint used for the tier figure. Tier cap is a $250/mo spend limit",
        "estimateMeta": {
          "sourceUrl": "https://ai.google.dev/gemini-api/docs/pricing",
          "sourceQuote": "Gemini 3.8 Flash input $0.75 / output $3.75 per 1M tokens (input price through December 31, 2026)",
          "sourceType": "derived",
          "confidence": "medium",
          "verifiedAt": "2026-09-19",
          "basisModel": "Gemini 3.8 Flash",
          "cacheAssumption": "75% cache hit rate at 25% of input price"
        }
      },
      "notes": "Pay-as-you-go billing with $250 credit threshold"
    },
    {
      "name": "Tier2",
      "monthlyPrice": null,
      "limits": {
        "spendCap": "$2,000/mo spend limit",
        "RPM": "2,000 requests/min",
        "TPM": "8,000,000 tokens/min"
      },
      "models": [
        "Gemini 3.8 Flash",
        "Gemini 3.1 Pro"
      ],
      "estimatedTokenBudget": {
        "description": "PAYG up to $2,000/mo limit (~500M tokens)",
        "estimatedMillionTokens": 500,
        "assumptions": "High volume developer spend",
        "estimateMeta": {
          "sourceUrl": "https://aistudio.google.com",
          "sourceType": "research",
          "confidence": "low",
          "verifiedAt": "2026-09-19"
        }
      },
      "notes": "Higher throughput tier unlocked after spend verification"
    },
    {
      "name": "Tier3",
      "monthlyPrice": null,
      "limits": {
        "spendCap": "$20,000-$100,000/mo spend limit",
        "RPM": "5,000+ requests/min",
        "TPM": "20,000,000+ tokens/min"
      },
      "models": [
        "Gemini 3.8 Flash",
        "Gemini 3.1 Pro"
      ],
      "estimatedTokenBudget": {
        "description": "Enterprise scale PAYG (~2B tokens)",
        "estimatedMillionTokens": 2000,
        "assumptions": "Tier3: dedicated capacity negotiations; well beyond 2,000 RPM PAYG tier ceilings",
        "estimateMeta": {
          "sourceUrl": "https://aistudio.google.com",
          "sourceType": "research",
          "confidence": "low",
          "verifiedAt": "2026-09-19"
        }
      },
      "notes": "Enterprise capacity with custom quota allocations"
    }
  ],
  "gotchas": [
    "Free tier data IS logged and used for model training and human review",
    "Promotional credits expire after 1 year and are non-refundable",
    "Context caching incurs continuous storage fees per hour"
  ],
  "tosHighlights": [
    "Free tier permits Google to review and train on prompts",
    "Paid tiers do not train and offer Google Cloud enterprise compliance"
  ],
  "dataTraining": "Yes on Free tier; No on Paid tiers",
  "ipIndemnity": false,
  "stackingPolicy": "unknown"
}