{
  "id": "minimax",
  "name": "MiniMax Token Plan",
  "category": "api-provider",
  "url": "https://platform.minimax.io/docs/guides/pricing-token-plan",
  "lastVerified": "2026-09-18",
  "tiers": [
    {
      "name": "Plus",
      "monthlyPrice": 22,
      "limits": {
        "quota": "5-hour rolling + weekly windows",
        "agents": "3-4 concurrent agents"
      },
      "models": [
        "MiniMax M3",
        "M2.7"
      ],
      "estimatedTokenBudget": {
        "description": "5h + weekly windows (~20M tokens/mo est.)",
        "estimatedMillionTokens": 20,
        "assumptions": "Research estimate; exact credits per window not officially published"
      },
      "notes": "Personal projects and prototyping"
    },
    {
      "name": "Max",
      "monthlyPrice": 55,
      "limits": {
        "quota": "5-hour rolling + weekly windows",
        "agents": "4-5 concurrent agents"
      },
      "models": [
        "MiniMax M3",
        "M2.7"
      ],
      "estimatedTokenBudget": {
        "description": "Higher windows (~65M tokens/mo est.)",
        "estimatedMillionTokens": 65,
        "assumptions": "Research estimate scaled ~3x over Plus tier (agents + multimodal); not officially published"
      },
      "notes": "Daily coding with agents and multimodal work"
    },
    {
      "name": "Ultra",
      "monthlyPrice": 132,
      "limits": {
        "quota": "5-hour rolling + weekly windows, extended sessions",
        "agents": "6-7 concurrent agents"
      },
      "models": [
        "MiniMax M3",
        "M2.7"
      ],
      "estimatedTokenBudget": {
        "description": "Highest windows (~160M tokens/mo est.)",
        "estimatedMillionTokens": 160,
        "assumptions": "Research estimate scaled ~8x over Plus tier tier; not officially published"
      },
      "notes": "Heavy agent workflows and extended sessions"
    },
    {
      "name": "Prepaid Credits",
      "monthlyPrice": null,
      "limits": {
        "credits": "$5 = 5,000 / $25 = 25,000 / $100 = 100,000 credits (1,000 credits = $1)",
        "validity": "365 days"
      },
      "models": [
        "All MiniMax models"
      ],
      "estimatedTokenBudget": {
        "description": "$1 per 1,000 credits",
        "estimatedMillionTokens": 0,
        "assumptions": "Overflow top-up for subscription users"
      },
      "notes": "Prepaid overflow packages"
    }
  ],
  "gotchas": [
    "Sold as 'Token Plan' subscription rather than a separate coding plan",
    "Exact credits inside 5h/weekly windows are not officially published - token estimates are research-derived",
    "MiniMax H3, voice design and rapid voice cloning not included",
    "Prepaid credits: 1,000 credits = $1, valid 365 days"
  ],
  "tosHighlights": [],
  "dataTraining": "Not published on pricing page",
  "ipIndemnity": false
}