{
  "id": "groq-api",
  "name": "Groq API",
  "category": "api-provider",
  "url": "https://console.groq.com",
  "lastVerified": "2026-09-18",
  "tiers": [
    {
      "name": "Free",
      "monthlyPrice": 0,
      "limits": {
        "limits": "Per-model RPM 10-30, RPD 100-1,000, TPM 1.2K-70K, TPD up to ~500K"
      },
      "models": [
        "GPT-OSS-120B",
        "Qwen3.8",
        "Kimi K3"
      ],
      "estimatedTokenBudget": {
        "description": "Per-model rate caps (~2-10M tokens/mo depending on model)",
        "estimatedMillionTokens": 5,
        "assumptions": "TPD ~500K tokens/day ceiling on high-capacity models ~= 15M/mo ceiling; conservative 5M used for typical models"
      },
      "notes": "Free plan for testing on LPUs"
    },
    {
      "name": "PAYG",
      "monthlyPrice": null,
      "limits": {
        "batchDiscount": "50% batch/caching discount",
        "throughput": "400-800 tokens/sec on LPU hardware"
      },
      "models": [
        "GPT-OSS-120B",
        "Qwen3.8",
        "Kimi K3",
        "Compound models"
      ],
      "estimatedTokenBudget": {
        "description": "Direct PAYG ($20 buys ~40M tokens)",
        "estimatedMillionTokens": 40,
        "assumptions": "$20 spent @ ~$0.50/M blended on open-weight serving"
      },
      "notes": "LPUs achieve 400-800 tokens/sec on served models"
    }
  ],
  "gotchas": [
    "Llama chat/vision models are GONE from Groq's catalog (only Llama Prompt-Guard safety models remain); lineup is now GPT-OSS/Qwen/Whisper/Compound",
    "Free-plan limits are per-model, not a single global quota",
    "Set manual spend caps to prevent runaway loops on ultra-fast inference"
  ],
  "tosHighlights": [
    "Zero data retention by default for paid accounts",
    "No customer data used for model training"
  ],
  "dataTraining": "No",
  "ipIndemnity": false
}