{
  "id": "meta-model-api",
  "name": "Meta Llama API",
  "category": "api-provider",
  "url": "https://dev.meta.ai/docs/pricing-rate-limits",
  "lastVerified": "2026-09-19",
  "tiers": [
    {
      "name": "Standard",
      "monthlyPrice": null,
      "limits": {
        "RPM": "3,000 requests/min",
        "TPM": "500,000 tokens/min",
        "price": "$1.25/M input, $4.25/M output (official)"
      },
      "models": [
        "Muse Spark 1.3",
        "Muse Spark 1.2"
      ],
      "estimatedTokenBudget": {
        "description": "Standard PAYG ($20 buys ~10M list-blend / ~14M cached-agent tokens)",
        "estimatedMillionTokens": 10,
        "perModelTokenBudgets": {
          "muse spark 1.3": {
            "estimatedMillionTokens": 10,
            "basis": "equal-rate",
            "confidence": "high"
          },
          "muse spark 1.2": {
            "estimatedMillionTokens": 10,
            "basis": "equal-rate",
            "confidence": "high"
          }
        },
        "midpointEstimate": 12,
        "optimisticEstimate": 14,
        "assumptions": "$20 at official Standard pricing $1.25/M input, $4.25/M output: 10M on a 3:1 list blend, ~14M on the standard 20K-in/1K-out agent request (no cache price published)",
        "estimateMeta": {
          "sourceUrl": "https://dev.meta.ai/docs/pricing-rate-limits",
          "sourceQuote": "Standard: $1.25 per 1M input tokens, $4.25 per 1M output tokens; prompts and completions are not used to train Meta models",
          "sourceType": "derived",
          "confidence": "medium",
          "verifiedAt": "2026-09-19",
          "basisModel": "Muse Spark 1.3"
        }
      },
      "notes": "Standard $1.25/$4.25/M. Hosted Llama tiers were superseded by Muse Spark models."
    },
    {
      "name": "Contributor",
      "monthlyPrice": null,
      "limits": {
        "RPM": "60 requests/min",
        "TPM": "30,000 tokens/min",
        "price": "$0.10-$0.20/M contributor pricing (~95% discount via muse-spark-1.2-contributor)"
      },
      "models": [
        "Muse Spark 1.2 (contributor)"
      ],
      "estimatedTokenBudget": {
        "description": "Contributor PAYG ($20 buys ~100M conservative / ~200M optimistic tokens)",
        "estimatedMillionTokens": 100,
        "midpointEstimate": 133,
        "optimisticEstimate": 200,
        "assumptions": "$20 at official Contributor pricing $0.10-$0.20/M in exchange for training rights: 100M at $0.20, 133M at $0.15, 200M at $0.10",
        "estimateMeta": {
          "sourceUrl": "https://dev.meta.ai/docs/pricing-rate-limits",
          "sourceQuote": "Contributor: $0.10-$0.20 per 1M tokens in exchange for permission to use prompts and completions to train Meta models",
          "sourceType": "derived",
          "confidence": "medium",
          "verifiedAt": "2026-09-19",
          "basisModel": "Muse Spark 1.2 (contributor)"
        }
      },
      "notes": "Contributor pricing applies to the muse-spark-1.2 family; prompts/outputs feed Meta training"
    }
  ],
  "gotchas": [
    "Contributor allows training on your data",
    "Contributor tier throttled to 60 RPM"
  ],
  "tosHighlights": [
    "Contributor tier data is retained permanently for model training",
    "Standard tier guarantees zero data retention and strict confidentiality"
  ],
  "dataTraining": "Yes for Contributor tier; No for Standard tier",
  "ipIndemnity": false,
  "stackingPolicy": "unknown"
}