{
  "id": "anthropic-api",
  "name": "Anthropic API",
  "category": "api-provider",
  "url": "https://console.anthropic.com",
  "lastVerified": "2026-09-19",
  "tiers": [
    {
      "name": "PAYG",
      "monthlyPrice": null,
      "limits": {
        "spendTiers": "Start $500/mo, Build $1,000/mo, Scale $200,000/mo (official 2026 tiers)",
        "cacheReadDiscount": "90% off cached input",
        "cacheWritePremium": "25% premium on cache writes",
        "batchDiscount": "50% off"
      },
      "models": [
        "Claude Fable 5.1",
        "Claude Opus 5",
        "Claude Sonnet 5",
        "Claude Haiku 4.5"
      ],
      "estimatedTokenBudget": {
        "description": "Direct API PAYG ($20 buys ~10M conservative / ~18M cached-agent Sonnet 5 tokens)",
        "estimatedMillionTokens": 10,
        "midpointEstimate": 18,
        "optimisticEstimate": 25,
        "assumptions": "$20 at Sonnet 5 ($2/M in, $10/M out): 5M on a 3:1 input:output list blend; ~18M on the standard 20K-in/1K-out agent request with 75% cache at 90% off; the 10M floor allows mixed Opus-class use and lower cache rates",
        "estimateMeta": {
          "sourceUrl": "https://docs.claude.com/en/docs/about-claude/pricing",
          "sourceQuote": "Claude Sonnet 5 $2 / MTok input, $10 / MTok output; cache reads 0.1x input",
          "sourceType": "derived",
          "confidence": "medium",
          "verifiedAt": "2026-09-19",
          "basisModel": "Claude Sonnet 5",
          "cacheAssumption": "75% cache hit rate at 90% discount"
        }
      },
      "notes": "Cache reads 90% off. Batch 50% off."
    }
  ],
  "gotchas": [
    "Rate limits and spend caps are tiered by cumulative spend (Start $500, Build $1,000, Scale $200,000+/mo); new accounts hit 429s on large codebases",
    "Thinking/reasoning tokens are billed at standard output token rates",
    "Cache write operations cost 25% more than base input tokens"
  ],
  "tosHighlights": [
    "Anthropic does not train models on API inputs or outputs",
    "Commercial IP indemnity provided under commercial terms of service"
  ],
  "dataTraining": "No (Commercial API zero retention)",
  "ipIndemnity": true,
  "stackingPolicy": "silent",
  "stackingPolicyNote": "Consumer/commercial terms ban sharing account credentials and API keys but do not address one person holding multiple paid accounts."
}