{
  "id": "fireworks-ai",
  "name": "Fireworks.ai",
  "category": "api-provider",
  "url": "https://fireworks.ai",
  "lastVerified": "2026-09-18",
  "tiers": [
    {
      "name": "Free",
      "monthlyPrice": 0,
      "limits": {
        "RPM": "10 requests/min",
        "trial": "$1 free credits"
      },
      "models": [
        "Llama 3.3 70B",
        "DeepSeek V3"
      ],
      "estimatedTokenBudget": {
        "description": "$1 free trial (~1M tokens)",
        "estimatedMillionTokens": 1,
        "assumptions": "$1 trial credits"
      },
      "notes": "Trial tier for function-calling evaluation"
    },
    {
      "name": "PAYG",
      "monthlyPrice": null,
      "limits": {
        "RPM": "6,000 requests/min with valid card",
        "batchDiscount": "50% off Batch API",
        "latency": "Sub-100ms TTFT"
      },
      "models": [
        "Llama 4 Maverick",
        "DeepSeek V4",
        "Kimi K3"
      ],
      "estimatedTokenBudget": {
        "description": "Serverless PAYG ($20 buys ~35M tokens)",
        "estimatedMillionTokens": 35,
        "assumptions": "$20 spent @ $0.55/M blended on Llama 70B"
      },
      "notes": "Serverless PAYG. 6000 RPM with card. Batch 50% off."
    }
  ],
  "gotchas": [
    "503 load shedding errors occur during saturated cluster load events",
    "Card required on file to unlock 6,000 RPM high throughput",
    "Fine-tuning deployment incurs hourly standby charges"
  ],
  "tosHighlights": [
    "No training on customer API inputs",
    "HIPAA and SOC2 compliance available on enterprise plans"
  ],
  "dataTraining": "No",
  "ipIndemnity": false
}