{
  "id": "ollama-cloud",
  "name": "Ollama Cloud",
  "category": "api-provider",
  "url": "https://ollama.com",
  "lastVerified": "2026-09-18",
  "tiers": [
    {
      "name": "Free",
      "monthlyPrice": 0,
      "limits": {
        "cloudModels": "Community hosted models",
        "concurrency": "1 stream",
        "localUse": "Unlimited local execution"
      },
      "models": [
        "Llama 3.2",
        "Qwen 2.5 Coder 7B"
      ],
      "estimatedTokenBudget": {
        "description": "Free cloud tier (~1M tokens/mo)",
        "estimatedMillionTokens": 1,
        "assumptions": "Free community rate limits"
      },
      "notes": "Free tier for running local and small cloud models"
    },
    {
      "name": "Pro",
      "monthlyPrice": 20,
      "annualPrice": 200,
      "limits": {
        "credits": "$60 cloud compute credits/mo",
        "concurrency": "3 concurrent streams",
        "peakSurcharge": "12:00-18:00 UTC peak rates"
      },
      "models": [
        "DeepSeek V4.1 Flash",
        "Llama 4 Code 70B",
        "Qwen 3.8 Max"
      ],
      "estimatedTokenBudget": {
        "description": "$60 compute credits (~60M tokens/mo)",
        "estimatedMillionTokens": 60,
        "assumptions": "$60 monthly cloud credit pool"
      },
      "notes": "Pro: $60 credits/mo, 3 concurrent. 3x compute value."
    },
    {
      "name": "Max",
      "monthlyPrice": 100,
      "limits": {
        "credits": "$300 cloud compute credits/mo",
        "concurrency": "10 concurrent streams",
        "peakSurcharge": "Standard rates"
      },
      "models": [
        "All Cloud Hosted Weights",
        "DeepSeek V4-Pro",
        "Llama 4 Maverick"
      ],
      "estimatedTokenBudget": {
        "description": "$300 compute credits (~300M tokens/mo)",
        "estimatedMillionTokens": 300,
        "assumptions": "$300 monthly cloud credit pool"
      },
      "notes": "Max: $300, 10 concurrent. Priority routing."
    },
    {
      "name": "Team",
      "monthlyPrice": 500,
      "limits": {
        "credits": "$1,600 cloud compute credits/mo",
        "concurrency": "50 concurrent streams",
        "privateEndpoints": "Dedicated pods"
      },
      "models": [
        "All Open Weights & Custom Fine-tunes"
      ],
      "estimatedTokenBudget": {
        "description": "$1,600 compute credits (~1.6B tokens/mo)",
        "estimatedMillionTokens": 1600,
        "assumptions": "$1,600 monthly credit pool"
      },
      "notes": "Dedicated private pods for software development teams"
    }
  ],
  "gotchas": [
    "credits don't roll over",
    "peak pricing 12-18 UTC"
  ],
  "tosHighlights": [
    "No training on cloud inference data",
    "Complete open-source local runtime"
  ],
  "dataTraining": "No",
  "ipIndemnity": false
}