{
  "id": "byteplus",
  "name": "BytePlus ModelArk Coding Plan",
  "category": "api-provider",
  "url": "https://www.byteplus.com/en/activity/arkcodingplan",
  "lastVerified": "2026-09-18",
  "tiers": [
    {
      "name": "Lite",
      "monthlyPrice": 10,
      "limits": {
        "usage": "3x the usage of the Claude Pro plan",
        "tools": "Claude Code, Cursor, Cline, Kilo Code, Roo Code, OpenCode"
      },
      "models": [
        "Dola-Seed-2.0-pro",
        "Dola-Seed-2.0-lite",
        "GLM-5.2",
        "DeepSeek-V4",
        "Kimi K2.5",
        "gpt-oss"
      ],
      "estimatedTokenBudget": {
        "description": "3x Claude Pro usage (~30M tokens/mo)",
        "estimatedMillionTokens": 30,
        "assumptions": "Benchmarked as multiplier vs Claude Pro consumer quota; exact credits unpublished",
        "estimateMeta": {
          "sourceUrl": "https://www.byteplus.com/en/activity/arkcodingplan",
          "sourceType": "research",
          "confidence": "low",
          "verifiedAt": "2026-09-18"
        }
      },
      "notes": "Flexible model selection or Auto mode"
    },
    {
      "name": "Pro",
      "monthlyPrice": 50,
      "limits": {
        "usage": "5x Lite usage (also marketed as 3x Claude Max usage)",
        "bonus": "ArkClaw included during subscription"
      },
      "models": [
        "Dola-Seed-2.0-pro",
        "Dola-Seed-2.0-lite",
        "GLM-5.2",
        "DeepSeek-V4 Series",
        "Kimi K2.5",
        "gpt-oss"
      ],
      "estimatedTokenBudget": {
        "description": "5x Lite (~150M tokens/mo)",
        "estimatedMillionTokens": 150,
        "assumptions": "5x the Lite research estimate",
        "estimateMeta": {
          "sourceUrl": "https://www.byteplus.com/en/activity/arkcodingplan",
          "sourceType": "research",
          "confidence": "low",
          "verifiedAt": "2026-09-18"
        }
      },
      "notes": "Model availability varies by country/region"
    }
  ],
  "gotchas": [
    "2026 refresh renamed models from Bytedance-Seed naming to Dola-Seed-2.0 pro/lite",
    "Quota is marketed as a multiplier of Claude Pro/Max plans, not absolute credits",
    "Model availability varies by region"
  ],
  "tosHighlights": [],
  "dataTraining": "Not published on pricing page",
  "ipIndemnity": false,
  "stackingPolicy": "unknown"
}