{
  "id": "openai-codex",
  "name": "OpenAI Codex (ChatGPT)",
  "category": "coding-ide",
  "url": "https://openai.com/chatgpt/pricing/",
  "lastVerified": "2026-09-18",
  "tiers": [
    {
      "name": "Free",
      "monthlyPrice": 0,
      "limits": {
        "codex": "Limited Codex access"
      },
      "models": [
        "GPT-5.6 Luna"
      ],
      "estimatedTokenBudget": {
        "description": "Limited Codex (~0.5M tokens/mo)",
        "estimatedMillionTokens": 0.5,
        "assumptions": "Occasional Codex tasks at ~150K tokens/task; exact limit not published"
      },
      "notes": "Unlimited GPT-5.6 Luna text chats included"
    },
    {
      "name": "Go",
      "monthlyPrice": 8,
      "limits": {
        "codex": "Limited Codex access; limited GPT-5.6 Terra",
        "bonus": "More uploads/voice/deep research, longer memory; may include ads"
      },
      "models": [
        "GPT-5.6 Luna",
        "GPT-5.6 Terra"
      ],
      "estimatedTokenBudget": {
        "description": "Light coding assistance (~2.5M tokens/mo)",
        "estimatedMillionTokens": 2.5,
        "assumptions": "Limited tasks at ~150K tokens/task; $8 price commonly cited but the scraped page did not render USD amounts"
      },
      "notes": "Entry tier; ads possible"
    },
    {
      "name": "Plus",
      "monthlyPrice": 20,
      "limits": {
        "codex": "Expanded Codex usage",
        "context": "GPT Reasoning 256K"
      },
      "models": [
        "GPT-6 Astra",
        "GPT-5.6 Sol",
        "GPT-5.6 Terra"
      ],
      "estimatedTokenBudget": {
        "description": "Expanded Codex (~12M tokens/mo)",
        "estimatedMillionTokens": 12,
        "assumptions": "Research estimate; no official numeric task limits"
      },
      "notes": "More uploads/projects"
    },
    {
      "name": "Pro (5x)",
      "monthlyPrice": 100,
      "limits": {
        "codex": "5x Plus usage; high-volume Codex"
      },
      "models": [
        "GPT-6 Astra",
        "GPT-5.6 Sol"
      ],
      "estimatedTokenBudget": {
        "description": "5x Plus (~60M tokens/mo)",
        "estimatedMillionTokens": 60,
        "assumptions": "5x the Plus research estimate"
      },
      "notes": "Intermediate tier; price unconfirmed (JS-hidden on page)"
    },
    {
      "name": "Pro (maximum)",
      "monthlyPrice": 200,
      "limits": {
        "codex": "Maximum Codex tasks",
        "context": "GPT Reasoning 400K context"
      },
      "models": [
        "GPT-6 Astra",
        "GPT-5.6 Sol Pro"
      ],
      "estimatedTokenBudget": {
        "description": "Maximum Codex (~250M tokens/mo)",
        "estimatedMillionTokens": 250,
        "assumptions": "Research estimate at max tier"
      },
      "notes": "Pro tier per official page; USD not rendered in scrape (commonly cited $200)"
    }
  ],
  "gotchas": [
    "Codex ships inside ChatGPT plans, not a separate product",
    "Codex access is Limited on Free/Go, Expanded on Plus, Maximum on Pro",
    "GPT-5.3-Codex appears in other registries (GitHub Copilot) but is not marketed on ChatGPT pricing",
    "Content is used to train OpenAI models; opt-out available on all tiers"
  ],
  "tosHighlights": [
    "Training opt-out available on all tiers"
  ],
  "dataTraining": "Used for training; opt-out available",
  "ipIndemnity": false
}