{
  "id": "replit",
  "name": "Replit",
  "category": "coding-ide",
  "url": "https://replit.com",
  "lastVerified": "2026-09-18",
  "tiers": [
    {
      "name": "Core",
      "monthlyPrice": 20,
      "limits": {},
      "models": [],
      "estimatedTokenBudget": null,
      "notes": "Effort-based checkpoint system"
    },
    {
      "name": "Pro",
      "monthlyPrice": 100,
      "limits": {},
      "models": [],
      "estimatedTokenBudget": null,
      "notes": "Effort-based checkpoint system"
    }
  ],
  "gotchas": [
    "unpredictable costs",
    "free daily chat caps"
  ],
  "tosHighlights": [],
  "dataTraining": "Yes",
  "ipIndemnity": false
}