{
  "id": "commandcode",
  "name": "CommandCode",
  "category": "coding-router",
  "url": "https://commandcode.ai/pricing",
  "lastVerified": "2026-09-19",
  "tiers": [
    {
      "name": "Go",
      "monthlyPrice": 1,
      "limits": {
        "credits": "$10/mo compute credits (up to ~$20 with deals)",
        "requests": "~15K"
      },
      "models": [
        "GPT-5.6 Luna",
        "Grok 4.5",
        "Qwen 3.8 Max",
        "MiniMax M3"
      ],
      "modelAllowances": {
        "open": 10.0,
        "default": 10.0
      },
      "estimatedTokenBudget": {
        "description": "$10 compute credits (~15M tokens on open models)",
        "estimatedMillionTokens": 15,
        "assumptions": "$10.00 / ~$0.65/M blended open-model rate ~= 15M tokens",
        "estimateMeta": {
          "sourceUrl": "https://commandcode.ai/pricing",
          "sourceType": "research",
          "confidence": "low",
          "verifiedAt": "2026-09-19"
        }
      },
      "notes": "Processing fee applies; open models + select premium"
    },
    {
      "name": "GOAT",
      "monthlyPrice": 10,
      "limits": {
        "credits": "$70/mo credits (up to ~$100 with deals)",
        "requests": "~75K"
      },
      "models": [
        "GPT-5.6 Sol",
        "GLM-5.2",
        "Tencent Hy3",
        "Qwen 3.8 27B",
        "DeepSeek V4 Flash"
      ],
      "modelAllowances": {
        "deepseek": 60.0,
        "economy": 60.0,
        "standard": 40.0,
        "frontier": 20.0,
        "default": 60.0
      },
      "estimatedTokenBudget": {
        "description": "$70 compute credits (~70M tokens)",
        "estimatedMillionTokens": 70,
        "assumptions": "$70.00 / ~$1/M blended ~= 70M tokens; per-model dollar allowances",
        "estimateMeta": {
          "sourceUrl": "https://commandcode.ai/pricing",
          "sourceType": "research",
          "confidence": "low",
          "verifiedAt": "2026-09-19"
        }
      },
      "notes": "29+ models"
    },
    {
      "name": "Pro",
      "monthlyPrice": 20,
      "limits": {
        "credits": "$80/mo credits",
        "requests": "~100K"
      },
      "models": [
        "Claude Opus 4.8",
        "GPT-5.6 Sol",
        "Gemini",
        "GLM-5.2",
        "MiniMax M3"
      ],
      "modelAllowances": {
        "deepseek": 80.0,
        "economy": 80.0,
        "standard": 60.0,
        "frontier": 30.0,
        "default": 80.0
      },
      "estimatedTokenBudget": {
        "description": "$80 compute credits (~80M tokens)",
        "estimatedMillionTokens": 80,
        "assumptions": "$80.00 / ~$1/M blended ~= 80M tokens; deals increase effective value",
        "estimateMeta": {
          "sourceUrl": "https://commandcode.ai/pricing",
          "sourceType": "research",
          "confidence": "low",
          "verifiedAt": "2026-09-19"
        }
      },
      "notes": "Adds all premium models incl Claude; 1M context"
    },
    {
      "name": "Max 10x",
      "monthlyPrice": 100,
      "limits": {
        "credits": "$150/mo credits (up to ~$300)",
        "requests": "~219K"
      },
      "models": [
        "All 30+ models"
      ],
      "modelAllowances": {
        "default": 150.0
      },
      "estimatedTokenBudget": {
        "description": "$150 compute credits (~150M tokens)",
        "estimatedMillionTokens": 150,
        "assumptions": "$150.00 / ~$1/M blended ~= 150M tokens",
        "estimateMeta": {
          "sourceUrl": "https://commandcode.ai/pricing",
          "sourceType": "research",
          "confidence": "low",
          "verifiedAt": "2026-09-19"
        }
      },
      "notes": "Higher rate limits"
    },
    {
      "name": "Max 20x",
      "monthlyPrice": 200,
      "limits": {
        "credits": "$300/mo credits (up to ~$600)",
        "requests": "~437K"
      },
      "models": [
        "All 30+ models"
      ],
      "modelAllowances": {
        "default": 300.0
      },
      "estimatedTokenBudget": {
        "description": "$300 compute credits (~300M tokens)",
        "estimatedMillionTokens": 300,
        "assumptions": "$300.00 / ~$1/M blended ~= 300M tokens",
        "estimateMeta": {
          "sourceUrl": "https://commandcode.ai/pricing",
          "sourceType": "research",
          "confidence": "low",
          "verifiedAt": "2026-09-19"
        }
      },
      "notes": "Highest rate limits; every model"
    }
  ],
  "gotchas": [
    "Domain moved from commandcode.dev to commandcode.ai",
    "Every plan adds a small processing fee on top of the sticker price",
    "Credits roll over forever; auto top-up billed at API cost",
    "Free tier retired - now paid; taste-1 learning data stored locally only"
  ],
  "tosHighlights": [
    "No training on your code; premium models US-hosted (EU on demand)"
  ],
  "dataTraining": "No training on your code",
  "ipIndemnity": false,
  "stackingPolicy": "prohibited",
  "stackingPolicyNote": "Terms: \"One account per person. You may not register, operate, or control more than one account... Creating, operating, or controlling multiple accounts is a material breach.\""
}