{
  "id": "kiro",
  "name": "Kiro",
  "category": "coding-ide",
  "url": "https://kiro.dev/pricing/",
  "lastVerified": "2026-09-18",
  "tiers": [
    {
      "name": "Free",
      "monthlyPrice": 0,
      "limits": {
        "credits": "50 credits/mo",
        "models": "Rate-limited Sonnet-class + open-weight models"
      },
      "models": [
        "Claude Sonnet 4.5",
        "Qwen3 Coder Next",
        "DeepSeek V3.2",
        "MiniMax M2.1"
      ],
      "estimatedTokenBudget": {
        "description": "50 credits/mo (~1M tokens)",
        "estimatedMillionTokens": 1,
        "assumptions": "Credits consumed fractionally per request at ~$0.04/credit equivalent on Sonnet blended rate",
        "estimateMeta": {
          "sourceUrl": "https://kiro.dev/pricing/",
          "sourceType": "research",
          "confidence": "low",
          "verifiedAt": "2026-09-18"
        }
      },
      "notes": "Usage cap renews at start of next billing cycle"
    },
    {
      "name": "Pro",
      "monthlyPrice": 20,
      "limits": {
        "credits": "1,000 credits/mo",
        "overage": "Add-on credit packs available"
      },
      "models": [
        "Claude Sonnet 5",
        "Claude Opus 5",
        "Auto mode",
        "Qwen3 Coder Next",
        "DeepSeek V3.2",
        "MiniMax M2.1"
      ],
      "estimatedTokenBudget": {
        "description": "1,000 credits/mo (~20M tokens on Sonnet 5)",
        "estimatedMillionTokens": 20,
        "assumptions": "1 credit ~= $0.04; $40 equivalent / ~$2/M blended on Sonnet 5 ~= 20M tokens",
        "estimateMeta": {
          "sourceUrl": "https://kiro.dev/pricing/",
          "sourceType": "research",
          "confidence": "low",
          "verifiedAt": "2026-09-18"
        }
      },
      "notes": "Premium models + open-weight pool; monthly billing cycle"
    },
    {
      "name": "Pro+",
      "monthlyPrice": 40,
      "limits": {
        "credits": "2,000 credits/mo",
        "overage": "Add-on credit packs available"
      },
      "models": [
        "Claude Sonnet 5",
        "Claude Opus 5",
        "Auto mode",
        "Qwen3 Coder Next",
        "DeepSeek V3.2",
        "MiniMax M2.1"
      ],
      "estimatedTokenBudget": {
        "description": "2,000 credits/mo (~40M tokens on Sonnet 5)",
        "estimatedMillionTokens": 40,
        "assumptions": "2,000 credits ~= $80 equivalent / ~$2/M blended ~= 40M tokens",
        "estimateMeta": {
          "sourceUrl": "https://kiro.dev/pricing/",
          "sourceType": "research",
          "confidence": "low",
          "verifiedAt": "2026-09-18"
        }
      },
      "notes": "Double Pro capacity"
    },
    {
      "name": "Pro Max",
      "monthlyPrice": 100,
      "limits": {
        "credits": "5,000 credits/mo",
        "overage": "Add-on credit packs available"
      },
      "models": [
        "Claude Sonnet 5",
        "Claude Opus 5",
        "Auto mode",
        "Open-weight models"
      ],
      "estimatedTokenBudget": {
        "description": "5,000 credits/mo (~100M tokens on Sonnet 5)",
        "estimatedMillionTokens": 100,
        "assumptions": "5,000 credits ~= $200 equivalent / ~$2/M blended ~= 100M tokens",
        "estimateMeta": {
          "sourceUrl": "https://kiro.dev/pricing/",
          "sourceType": "research",
          "confidence": "low",
          "verifiedAt": "2026-09-18"
        }
      },
      "notes": "Heavier agentic usage"
    },
    {
      "name": "Power",
      "monthlyPrice": 200,
      "limits": {
        "credits": "10,000 credits/mo",
        "overage": "Add-on credit packs available"
      },
      "models": [
        "Claude Sonnet 5",
        "Claude Opus 5",
        "Auto mode",
        "Open-weight models"
      ],
      "estimatedTokenBudget": {
        "description": "10,000 credits/mo (~200M tokens on Sonnet 5)",
        "estimatedMillionTokens": 200,
        "assumptions": "10,000 credits ~= $400 equivalent / ~$2/M blended ~= 200M tokens",
        "estimateMeta": {
          "sourceUrl": "https://kiro.dev/pricing/",
          "sourceType": "research",
          "confidence": "low",
          "verifiedAt": "2026-09-18"
        }
      },
      "notes": "Maximum capacity tier added Aug 2026"
    }
  ],
  "gotchas": [
    "Credits reset monthly at billing-cycle start, not rolling 5-hour windows",
    "Credits are consumed fractionally per request; complex spec-driven tasks burn many credits",
    "Not all premium models are available in every country/region",
    "AWS owns Kiro - usage governed under AWS terms"
  ],
  "tosHighlights": [],
  "dataTraining": "Not published on pricing page",
  "ipIndemnity": false,
  "stackingPolicy": "silent",
  "stackingPolicyNote": "FAQ: \"subscriptions and usage limits are calculated per individual user\"; sharing is not permitted, multiple paid accounts are not addressed."
}