{
  "id": "windsurf",
  "name": "Windsurf (Cognition)",
  "category": "coding-ide",
  "url": "https://windsurf.com/pricing",
  "lastVerified": "2026-09-18",
  "tiers": [
    {
      "name": "Free",
      "monthlyPrice": 0,
      "limits": {
        "quota": "Light auto-refreshing usage allowance (daily + weekly)",
        "models": "Limited model availability",
        "concurrency": "Up to 10 concurrent sessions"
      },
      "models": [
        "SWE-2",
        "Kimi K2.5",
        "GPT 5.2 Mini",
        "Claude Haiku 4.5"
      ],
      "estimatedTokenBudget": {
        "description": "Light agent quota (~2M tokens/mo)",
        "estimatedMillionTokens": 2,
        "assumptions": "Usage allowance refreshes daily+weekly; size not published; research estimate at ~150K tokens/agent task, low confidence"
      },
      "notes": "Unlimited inline edits and Tab completions"
    },
    {
      "name": "Pro",
      "monthlyPrice": 20,
      "limits": {
        "quota": "Increased auto-refreshing daily + weekly allowance (size not published)",
        "overage": "Extra usage purchased at API pricing",
        "concurrency": "Up to 10 concurrent sessions"
      },
      "models": [
        "SWE-2",
        "Claude Sonnet 5",
        "Claude Haiku 4.5",
        "GPT-5.2 Mini",
        "Kimi K2.5"
      ],
      "estimatedTokenBudget": {
        "description": "Pro daily+weekly quota (~45M tokens/mo)",
        "estimatedMillionTokens": 45,
        "assumptions": "Research estimate: ~150K tokens/agent task * ~300 agent tasks/mo; official quotas unpublished, low confidence"
      },
      "notes": "Frontier OpenAI/Claude/Gemini access + open-source models; Devin Cloud included"
    },
    {
      "name": "Max",
      "monthlyPrice": 200,
      "limits": {
        "quota": "Significantly higher daily + weekly allowance (size not published)",
        "overage": "Extra usage at API pricing",
        "concurrency": "Unlimited concurrent sessions"
      },
      "models": [
        "SWE-2",
        "Claude Sonnet 5",
        "Claude Haiku 4.5",
        "GPT-5.2 Mini",
        "Kimi K2.5"
      ],
      "estimatedTokenBudget": {
        "description": "Max daily+weekly quota (~225M tokens/mo)",
        "estimatedMillionTokens": 225,
        "assumptions": "Research estimate scaled from Pro tier (10x presumed headroom), low confidence"
      },
      "notes": "Power tier for daily-driver agent workflows"
    },
    {
      "name": "Teams",
      "monthlyPrice": 80,
      "limits": {
        "quota": "Pro-level quota per full dev seat",
        "billing": "$80/mo team base + $40/mo per full user seat",
        "concurrency": "Unlimited concurrent sessions"
      },
      "models": [
        "SWE-2",
        "Claude Sonnet 5",
        "Claude Haiku 4.5",
        "GPT-5.2 Mini",
        "Kimi K2.5"
      ],
      "estimatedTokenBudget": {
        "description": "Pro-level quota per full user seat (~45M tokens/mo/seat)",
        "estimatedMillionTokens": 45,
        "assumptions": "Per-seat quota mirrors Pro tier; additional seats $40/mo each"
      },
      "notes": "Includes Devin Desktop, sharing, centralized billing, admin analytics"
    }
  ],
  "gotchas": [
    "After Cognition's acquisition, windsurf.com/pricing serves the Devin-branded plan sheet; there is no separate Windsurf editor pricing",
    "Quotas are undisclosed 'usage allowances' that refresh daily and weekly; overage is consumed at API pricing",
    "SWE-2 is included free in Devin Desktop and CLI only through Oct 10, 2026",
    "Message cost varies by model, task size and complexity - not a fixed token count",
    "Old 'Cascade prompts' / 'Fast prompts' terminology is retired from pricing"
  ],
  "tosHighlights": [
    "Concurrent sessions: up to 10 on Free/Pro, unlimited on Max/Teams"
  ],
  "dataTraining": "Not published on pricing page",
  "ipIndemnity": false
}